Nombre,Subnombre,Temas,Subtemas,Tipos,Subtipos,Subsubtipos,Perfiles,Fecha de inicio,Fecha de fin,Hora de inicio,Hora de fin,Distrito,Url de ficha,Equipamiento,Localizacion,Coordenada X (UTM),Coordenada Y (UTM),Coordenada X,Coordenada Y,Texto,Fecha de inscripción empadronados,Fecha de inscripción empleados,Fecha de inscripción general,Temática
"(2017-2018) Programa de Actividades Escuelas Deportivas Municipales","","Deportes","Servicios Deportes","Deportes","Escuelas Deportivas","","Adultos|Discapacidad|Infancia y Adolescencia|Mayores", 25/09/2017, 30/06/2018,,,"","http://www.alcobendas.org/es/cargarFichaAgenda.do?identificador=508","Varios","","","","","","<div class=""datosinteres""><h4><img alt="""" class=""img_Sin"" id=""Imagen_10_3017455099132"" src=""http://www.alcobendas.org/recursos/img/Comunes/895869469_262010131247.gif"" /> Datos de inter&eacute;s</h4><div class=""separador""><h5>Descripci&oacute;n</h5><p>Puede consultar el folleto con todas las actividades deportivas programadas en las Escuelas Deportivas Municipales de Alcobendas. Consulta de horarios, precios, requisitos de inscripci&oacute;n, etc. </p><p><strong>Periodos de inscripci&oacute;n:</strong> </p><ul class=""tipo1"">	<li><strong>Empadronados&nbsp;en Alcobendas:</strong> 	<div style=""width: 100%"">	<ul class=""tipo1"">		<li>A partir del&nbsp;31 de mayo, nataci&oacute;n</li>		<li>A partir del&nbsp;1 de junio, escuelas deportivas.</li>		<li>A partir del&nbsp;20 de julio, actividades Servicio M&eacute;dico</li>	</ul>	</div>	</li>	<li><strong>No empadronados</strong>: A partir del&nbsp;&nbsp;27 de junio.</li>	<h5></h5>	<div class=""teinteresa recursos"">	<h3>Documentos</h3>	<div class=""info"">	<ul>		<li><a href=""http://www.alcobendas.org/es/portal.do?TR=A&amp;IDR=1&amp;identificador=3919"" id=""Documento_3919_3164173691940"">Programa de actividades Escuelas Deportivas Municipales</a></li>	</ul>	</div>	</div></ul></div></div><!--fin fichaterritoriales--><div class=""modulo100""><!--fin fichaterritoriales--></div>",,,,""
"Acondicionamiento cardiovascular para titulares de abono deporte","","Deportes","Servicios Deportes","Deportes","Abono Deporte|Medicina Deportiva","Actividades de salud","Adultos", 18/09/2017, 29/06/2018,,,"Norte","http://www.alcobendas.org/es/cargarFichaAgenda.do?identificador=1109","Ciudad Deportiva Valdelasfuentes","http://mapa.alcobendas.org/index.html?center=%2Ffeature%2Fpoi_deporte%5Bf_id%3D67%5D&amp;zoom=18","445113.15000008437","4489103.679999999","40.55087447901411","-3.6482436189666894","<div class=""modulo100""><div class=""datosinteres""><h4><img alt="""" class=""img_Sin"" id=""Imagen_10_3836894339778"" src=""http://www.alcobendas.org/recursos/img/Comunes/895869469_262010131247.gif"" /> Datos de inter&eacute;s</h4><div class=""separador""><h5>Descripci&oacute;n</h5><p>Programa anual de ejercicios espec&iacute;ficos para usuarios con enfermedad cardiovascular o acumulaci&oacute;n de factores de riesgo.&nbsp; </p><h5>Requisitos</h5><ul class=""tipo1"">	<li>Estar dado de alta en el Abono Deporte </li>	<li><a href=""http://www.alcobendas.org/es/cargarFichaTramite.do?identificador=201"" id=""FichaTramite_201"">Valoraci&oacute;n por parte del Servicio de Medicina Deportiva&nbsp;</a>&nbsp; </li>	<li>Prescripci&oacute;n del ejercicio </li>	<li>Autorizaci&oacute;n e inscripci&oacute;n en la actividad</li></ul><h5>Horario&nbsp;&nbsp;&nbsp;&nbsp;&nbsp;&nbsp;&nbsp;&nbsp;&nbsp;&nbsp; </h5><h6 class=""tipo1""></h6><p><strong>Curso dos d&iacute;as a la semana:</strong> </p><ul class=""tipo1"">	<li><strong>L-X&nbsp; </strong>de<strong> </strong>09:00 -&nbsp;09:50 h.</li>	<li><strong>M-J </strong>de<strong> </strong>18:00 - 18:50 h.</li></ul><h5>Precio</h5><p>Pago trimestral: </p><ul class=""tipo1"">	<li>2 d&iacute;as a la semana: 23,80 &euro;/ mes&nbsp;&nbsp; </li></ul><h5>Inscripci&oacute;n&nbsp;&nbsp; </h5><p>Consulte&nbsp;la informaci&oacute;n necesaria&nbsp;para <a href=""http://www.alcobendas.org/es/cargarFichaTramite.do?identificador=226"" id=""FichaTramite_226"">inscribirse los titulares de&nbsp;abono deporte.</a> </p><h5>Bajas y devoluciones</h5><p>Consulte la informaci&oacute;n sobre <a href=""http://www.alcobendas.org/es/portal.do?TR=A&amp;IDR=1&amp;identificador=2976"" id=""Documento_2976_9126509620789"">administraci&oacute;n y cobranza precios p&uacute;blicos del PMD.</a> </p><h5 class=""tipo1"">Informaci&oacute;n de inter&eacute;s:</h5><ul class=""tipo1"">	<li>Se podr&aacute;n anular los grupos en los que no se cubran el 50% de las plazas ofertadas (antes de inicio del curso y/o durante el transcurso del mismo).<br />	</li>	<li>Las clases que sean suspendidas por condiciones climatol&oacute;gicas adversas y/o por aver&iacute;a t&eacute;cnica (piscinas y gimnasios), y que no puedan ser impartidas en otro lugar alternativo, no tendr&aacute;n derecho a devoluci&oacute;n.</li>	<li>Por motivos de programaci&oacute;n, los espacios asignados a las actividades podr&aacute;n ser modificados por el Patronato Municipal de Deportes.<br />	</li>	<li>La inscripci&oacute;n en la actividad otorga al Ayuntamiento permiso para usar, publicar, exponer, producir, duplicar y distribuir reproducciones fotogr&aacute;ficas, grabaciones en audio/v&iacute;deo realizadas durante el evento en cualquier formato, para uso divulgativo y deportivo, respetando en todo momento el derecho al honor, a la intimidad personal y a la propia imagen de los usuarios.</li></ul><p>Consulte el <a href=""http://www.alcobendas.org/es/portal.do?TR=A&amp;IDR=1&amp;identificador=3040"" id=""Documento_3040_4842915360725"">Programa de Actividades Abono Deporte&nbsp;</a>&nbsp;&nbsp; </p></div></div></div><!--fin fichaterritoriales-->",,,20/07/2017,"Salud"
"Aerobic","Escuelas deportivas","Deportes","Servicios Deportes","Deportes","Escuelas Deportivas","Gimnasia","Adultos", 01/09/2017, 30/06/2018,,,"","http://www.alcobendas.org/es/cargarFichaAgenda.do?identificador=1565","Polideportivo José Caballero","http://mapa.alcobendas.org/index.html?center=%2Ffeature%2Fpoi_deporte%5Bf_id%3D73%5D&amp;zoom=18","446527.0600000703","4488361.057","40.54427711895707","-3.6314827073471703","<div class=""modulo100""><div class=""datosinteres""><h4><img alt="""" class=""img_Sin"" id=""Imagen_10_7273703380931"" src=""http://www.alcobendas.org/recursos/img/Comunes/895869469_262010131247.gif"" /> Datos de inter&eacute;s</h4><div class=""separador""><h5></h5><h5>Descripci&oacute;n</h5><p>Actividad f&iacute;sica con base musical que&nbsp;busca la mejora y/o el mantenimiento de la condici&oacute;n f&iacute;sica.&nbsp;&nbsp; </p><p>Dirigido a mayores de 18 a&ntilde;os. </p><h5>Horario</h5><ul>	<li>Lunes y Mi&eacute;rcoles, de 20:30 a 21:20 h.&nbsp;Polideportivo Municipal </li></ul><h5>Precio</h5><p>Pago trimestral </p><ul class=""tipo1"">	<li>Empadronados: 22 &euro;/mes</li>	<li>No empadronados:&nbsp;33 &euro;/mes&nbsp;&nbsp;&nbsp;&nbsp;&nbsp; </li></ul><h5>Inscripci&oacute;n&nbsp;</h5><p><a href=""http://www.alcobendas.org/es/cargarFichaTramite.do?identificador=199"" id=""FichaTramite_199"">Toda la informaci&oacute;n para inscribirse</a> </p><h5>Bajas y devoluciones</h5><p>Consulta la informaci&oacute;n sobre <a href=""http://www.alcobendas.org/es/portal.do?TR=A&amp;IDR=1&amp;identificador=2976"" id=""Documento_2976_1356456823980"">Precios P&uacute;blicos del Patronato Municipal de Deportes&nbsp; </a></p><h5>Informaci&oacute;n de inter&eacute;s</h5><ul class=""tipo1"">	<li>Per&iacute;odos de vacaciones:<strong> Navidad:</strong> del 23 de diciembre de 2017 al&nbsp;7 de enero de 2018. <strong>Semana Santa:</strong> del 26 de marzo al 2 de abril de 2018.</li>	<li>Los d&iacute;as festivos durante el curso no habr&aacute; clases. </li>	<li>Se podr&aacute;n anular los grupos en los que no se cubran el 50% de las plazas ofertadas (antes de inicio del curso y/o durante el transcurso del mismo).</li>	<li>El pago del precio p&uacute;blico da derecho a las clases o sesiones concertadas en el programa (uno, dos o tres d&iacute;as a la semana), siendo la participaci&oacute;n en competiciones y fines de semana un acuerdo entre el participante y la entidad o club correspondiente, as&iacute; como el pago de fichas federativas, pruebas de grado y/o vestuario deportivo del club.</li>	<li>Las clases que sean suspendidas por condiciones climatol&oacute;gicas adversas y/o por aver&iacute;a t&eacute;cnica (piscinas y gimnasios), y que no puedan ser impartidas en otro lugar alternativo, no tendr&aacute;n derecho a devoluci&oacute;n.</li>	<li>Por motivos de programaci&oacute;n, los espacios asignados a las actividades podr&aacute;n ser modificados por el Patronato Municipal de Deportes.</li>	<li>La inscripci&oacute;n en la actividad otorga al Ayuntamiento permiso para usar, publicar, exponer, producir, duplicar y distribuir reproducciones fotogr&aacute;ficas, grabaciones en audio/v&iacute;deo realizadas durante el evento en cualquier formato, para uso divulgativo y deportivo, respetando en todo momento el derecho al honor, a la intimidad personal y a la propia imagen de los usuarios.</li></ul><p><a href=""http://www.alcobendas.org/es/portal.do?TR=A&amp;IDR=1&amp;identificador=3919"" id=""Documento_3919_7576618460669"">Ver programaci&oacute;n completa de Actividades de las Escuelas Deportivas&nbsp;</a>&nbsp; </p></div></div><!--fin fichaterritoriales--></div>",01/06/2017,,27/06/2017,""
"Aikido (7 a 15 años)","Escuelas deportivas","Deportes","Servicios Deportes","Deportes","Escuelas Deportivas","Otros","Infancia y Adolescencia", 25/09/2017, 30/06/2018,,,"Urbanizaciones","http://www.alcobendas.org/es/cargarFichaAgenda.do?identificador=1853","Polideportivo José Caballero","http://mapa.alcobendas.org/index.html?center=%2Ffeature%2Fpoi_deporte%5Bf_id%3D73%5D&amp;zoom=18","446527.0600000703","4488361.057","40.54427711895707","-3.6314827073471703","<table width=""40%"">	<tbody>	</tbody></table><div class=""modulo100""><div class=""datosinteres""><h4><img alt="""" class=""img_Sin"" id=""Imagen_10_981129255310"" src=""http://www.alcobendas.org/recursos/img/Comunes/895869469_262010131247.gif"" /> Datos de inter&eacute;s</h4><div class=""separador""><h5>Descripci&oacute;n</h5><p>Arte Marcial Japon&eacute;s, sin competici&oacute;n, que pretende armonizar una situaci&oacute;n de conflicto, uni&eacute;ndose a ella, sin poner oposici&oacute;n bajo el principio de valoraci&oacute;n mutua. Se busca la firmeza interior que no depende de la fuerza f&iacute;sica, los a&ntilde;os o el sexo. Es apto para ni&ntilde;os y ni&ntilde;as. Se trabaja la concentraci&oacute;n, sensibilidad, coordinaci&oacute;n, respeto, disciplina y flexibilidad (f&iacute;sica y mental). </p><h5>Horario</h5><table width=""75%"">	<tbody>		<tr>			<td><strong>&nbsp;Edad</strong></td>			<td><strong>&nbsp;Horario</strong></td>			<td><strong>&nbsp;D&iacute;as</strong></td>			<td><strong>&nbsp;Instalaci&oacute;n</strong></td>		</tr>		<tr>			<td>&nbsp;7 a 11 a&ntilde;os</td>			<td>&nbsp;18:00 - 19:00</td>			<td>&nbsp;Jueves</td>			<td>&nbsp;Polidep. Municipal (Gimn 4)</td>		</tr>		<tr>			<td>12 a 15 a&ntilde;os&nbsp;</td>			<td>&nbsp;18:00 - 19:30</td>			<td>&nbsp;Martes</td>			<td>&nbsp;Polidep. Municipal (Gimn 4)</td>		</tr>	</tbody></table><h5>Precio</h5><p>Pago trimestral. </p><p>Duraci&oacute;n de la clase: 90 minutos (1 d&iacute;a a la semana): </p><ul class=""tipo1"">	<li>Empadronados: 20,40 &euro;/mes.&nbsp; </li>	<li>No empadronados: 30,60 &euro;/mes. </li></ul><p>Duraci&oacute;n de la clase: 60 minutos (1 d&iacute;a a la semana): </p><ul class=""tipo1"">	<li>Empadronados: 13,30 &euro;/mes </li>	<li>No empadronados: 19,90 &euro;/mes.&nbsp; </li></ul><h5>Inscripci&oacute;n&nbsp;</h5><p><a href=""http://www.alcobendas.org/es/cargarFichaTramite.do?identificador=199"" id=""FichaTramite_199"">Toda la informaci&oacute;n para inscribirse</a> </p><h5>Bajas y devoluciones</h5><p>Consulta la informaci&oacute;n sobre <a href=""http://www.alcobendas.org/es/portal.do?TR=A&amp;IDR=1&amp;identificador=2976"" id=""Documento_2976_8219099145895"">Precios P&uacute;blicos del Patronato Municipal de Deportes&nbsp; </a></p><h5>Informaci&oacute;n de inter&eacute;s</h5><ul class=""tipo1"">	<li>Per&iacute;odos de vacaciones:<strong> Navidad:</strong> del 23 de diciembre de 2017 al&nbsp;7 de enero de 2018. <strong>Semana Santa:</strong> del 26 de marzo al 2 de abril de 2018.</li>	<li>Los d&iacute;as festivos durante el curso no habr&aacute; clases. </li>	<li>Se podr&aacute;n anular los grupos en los que no se cubran el 50% de las plazas ofertadas (antes de inicio del curso y/o durante el transcurso del mismo).</li>	<li>El pago del precio p&uacute;blico da derecho a las clases o sesiones concertadas en el programa (uno, dos o tres d&iacute;as a la semana), siendo la participaci&oacute;n en competiciones y fines de semana un acuerdo entre el participante y la entidad o club correspondiente, as&iacute; como el pago de fichas federativas, pruebas de grado y/o vestuario deportivo del club.</li>	<li>Las clases que sean suspendidas por condiciones climatol&oacute;gicas adversas y/o por aver&iacute;a t&eacute;cnica (piscinas y gimnasios), y que no puedan ser impartidas en otro lugar alternativo, no tendr&aacute;n derecho a devoluci&oacute;n.</li>	<li>Por motivos de programaci&oacute;n, los espacios asignados a las actividades podr&aacute;n ser modificados por el Patronato Municipal de Deportes.</li>	<li>La inscripci&oacute;n en la actividad otorga al Ayuntamiento permiso para usar, publicar, exponer, producir, duplicar y distribuir reproducciones fotogr&aacute;ficas, grabaciones en audio/v&iacute;deo realizadas durante el evento en cualquier formato, para uso divulgativo y deportivo, respetando en todo momento el derecho al honor, a la intimidad personal y a la propia imagen de los usuarios.</li></ul><p><a href=""http://www.alcobendas.org/es/portal.do?TR=A&amp;IDR=1&amp;identificador=3919"" id=""Documento_3919_9265306257344"">Ver programaci&oacute;n completa de Actividades de las Escuelas Deportivas&nbsp;</a>&nbsp; </p></div></div><!--fin fichaterritoriales--></div>",01/06/2017,,27/06/2017,""
"Aikido (A partir de 16 años)","Escuelas deportivas","Deportes","Servicios Deportes","Deportes","Escuelas Deportivas","Gimnasia","Adultos", 25/09/2017, 30/06/2018,,,"","http://www.alcobendas.org/es/cargarFichaAgenda.do?identificador=1541","Polideportivo José Caballero","http://mapa.alcobendas.org/index.html?center=%2Ffeature%2Fpoi_deporte%5Bf_id%3D73%5D&amp;zoom=18","446527.0600000703","4488361.057","40.54427711895707","-3.6314827073471703","<div class=""modulo100""><div class=""datosinteres""><h4><img alt="""" class=""img_Sin"" id=""Imagen_10_6886602584466"" src=""http://www.alcobendas.org/recursos/img/Comunes/895869469_262010131247.gif"" /> Datos de inter&eacute;s</h4><div class=""separador""><h5></h5><h5>Descripci&oacute;n</h5><p>Arte marcial japon&eacute;s, sin competici&oacute;n, que pretende armonizar una situaci&oacute;n de conflicto, uni&eacute;ndose a ella, sin poner oposici&oacute;n bajo el principio de valoraci&oacute;n mutua. Se busca la firmeza interior que no depende de la fuerza f&iacute;sica, los a&ntilde;os o el sexo. Es apto para mujeres y hombres. </p><p>Se trabaja la concentraci&oacute;n, sensibilidad, coordinaci&oacute;n, respeto, disciplina y flexibilidad (f&iacute;sica y mental). Los estudiantes que lo deseen, podr&aacute;n validar grados abonando las cuotas correspondientes. </p><p>Dirigido a mayores de 16 a&ntilde;os. </p><h5>Horario</h5><ul>	<li>Martes y Jueves, de 19:30 a 20:30 h.&nbsp;los martes y de 19:00 a 20:00 h.&nbsp;los jueves. </li></ul><h5>Precio</h5><p>Pago trimestral </p><ul class=""tipo1"">	<li>Empadronados: 29 &euro;/mes</li>	<li>No empadronados:&nbsp;43,50 &euro;/mes&nbsp;&nbsp;&nbsp;&nbsp;&nbsp; </li></ul><h5>Inscripci&oacute;n&nbsp;</h5><p><a href=""http://www.alcobendas.org/es/cargarFichaTramite.do?identificador=199"" id=""FichaTramite_199"">Toda la informaci&oacute;n para inscribirse</a> </p><h5>Bajas y devoluciones</h5><p>Consulta la informaci&oacute;n sobre <a href=""http://www.alcobendas.org/es/portal.do?TR=A&amp;IDR=1&amp;identificador=2976"" id=""Documento_2976_2257336771171"">Precios P&uacute;blicos del Patronato Municipal de Deportes&nbsp; </a></p><h5>Informaci&oacute;n de inter&eacute;s</h5><ul class=""tipo1"">	<li>Per&iacute;odos de vacaciones:<strong> Navidad:</strong> del 23 de diciembre de 2017 al&nbsp;7 de enero de 2018. <strong>Semana Santa:</strong> del 26 de marzo al 2 de abril de 2018.</li>	<li>Los d&iacute;as festivos durante el curso no habr&aacute; clases. </li>	<li>Se podr&aacute;n anular los grupos en los que no se cubran el 50% de las plazas ofertadas (antes de inicio del curso y/o durante el transcurso del mismo).</li>	<li>El pago del precio p&uacute;blico da derecho a las clases o sesiones concertadas en el programa (uno, dos o tres d&iacute;as a la semana), siendo la participaci&oacute;n en competiciones y fines de semana un acuerdo entre el participante y la entidad o club correspondiente, as&iacute; como el pago de fichas federativas, pruebas de grado y/o vestuario deportivo del club.</li>	<li>Las clases que sean suspendidas por condiciones climatol&oacute;gicas adversas y/o por aver&iacute;a t&eacute;cnica (piscinas y gimnasios), y que no puedan ser impartidas en otro lugar alternativo, no tendr&aacute;n derecho a devoluci&oacute;n.</li>	<li>Por motivos de programaci&oacute;n, los espacios asignados a las actividades podr&aacute;n ser modificados por el Patronato Municipal de Deportes.</li>	<li>La inscripci&oacute;n en la actividad otorga al Ayuntamiento permiso para usar, publicar, exponer, producir, duplicar y distribuir reproducciones fotogr&aacute;ficas, grabaciones en audio/v&iacute;deo realizadas durante el evento en cualquier formato, para uso divulgativo y deportivo, respetando en todo momento el derecho al honor, a la intimidad personal y a la propia imagen de los usuarios.</li></ul><p><a href=""http://www.alcobendas.org/es/portal.do?TR=A&amp;IDR=1&amp;identificador=3919"" id=""Documento_3919_750997181239"">Ver programaci&oacute;n completa de Actividades de las Escuelas Deportivas&nbsp;</a>&nbsp; </p></div></div><!--fin fichaterritoriales--></div>",01/06/2017,,27/06/2017,""
"Ajedrez","Escuelas deportivas","Deportes","Servicios Deportes","Deportes","Escuelas Deportivas","Otros","Infancia y Adolescencia", 25/09/2017, 30/06/2018,,,"Norte","http://www.alcobendas.org/es/cargarFichaAgenda.do?identificador=1854","Ciudad Deportiva Valdelasfuentes","http://mapa.alcobendas.org/index.html?center=%2Ffeature%2Fpoi_deporte%5Bf_id%3D67%5D&amp;zoom=18","445113.15000008437","4489103.679999999","40.55087447901411","-3.6482436189666894","<table width=""40%"">	<tbody>	</tbody></table><div class=""modulo100""><div class=""datosinteres""><h4><img alt="""" class=""img_Sin"" id=""Imagen_10_6216511267879"" src=""http://www.alcobendas.org/recursos/img/Comunes/895869469_262010131247.gif"" /> Datos de inter&eacute;s</h4><div class=""separador""><h5>Descripci&oacute;n</h5><p>Iniciaci&oacute;n y perfeccionamiento de los movimientos, aperturas y jugadas de este deporte de estrategia: el tablero, las piezas, capturas y mates b&aacute;sicos. Aperturas, fundamentos estrat&eacute;gicos y finales. </p><p>Una vez comenzado el curso ser&aacute; obligatorio para nuevos usuarios, dirigirse a la instalaci&oacute;n, d&iacute;a y hora que se indica y hablar con el responsable.&nbsp; </p><h5>Horario</h5><table width=""70%"">	<tbody>		<tr>			<td>&nbsp;<strong>NIVEL</strong></td>			<td><strong>&nbsp;EDAD</strong></td>			<td><strong>&nbsp;D&Iacute;AS</strong></td>			<td><strong>&nbsp;HORARIO</strong></td>		</tr>		<tr>			<td>&nbsp;1</td>			<td>&nbsp;2008-2011</td>			<td>&nbsp;Lunes/Mi&eacute;rcoles</td>			<td>&nbsp;17:30 -18:15</td>		</tr>		<tr>			<td>&nbsp;1</td>			<td>&nbsp;2008-2011</td>			<td>&nbsp;Martes/Jueves</td>			<td>&nbsp;18:15 -19:00 </td>		</tr>		<tr>			<td>&nbsp;2</td>			<td>&nbsp;2006-2007</td>			<td>&nbsp;Viernes</td>			<td>&nbsp;17:30 -19:00</td>		</tr>		<tr>			<td>&nbsp;3</td>			<td>&nbsp;2000-2005</td>			<td>&nbsp;Viernes</td>			<td>&nbsp;18:30 -20:00 </td>		</tr>	</tbody></table><h5></h5><h5></h5><h5>Precio</h5><p>Pago trimestral. </p><ul class=""tipo1"">	<li>Empadronados:&nbsp;18 &euro;/mes. </li>	<li>No empadronados:&nbsp;27 &euro;/mes. </li></ul><h5>Inscripci&oacute;n&nbsp;</h5><p><a href=""http://www.alcobendas.org/es/cargarFichaTramite.do?identificador=199"" id=""FichaTramite_199"">Toda la informaci&oacute;n para inscribirse</a> </p><h5>Bajas y devoluciones</h5><p>Consulta la informaci&oacute;n sobre <a href=""http://www.alcobendas.org/es/portal.do?TR=A&amp;IDR=1&amp;identificador=2976"" id=""Documento_2976_386063054432"">Precios P&uacute;blicos del Patronato Municipal de Deportes&nbsp; </a></p><h5>Informaci&oacute;n de inter&eacute;s</h5><ul class=""tipo1"">	<li>Per&iacute;odos de vacaciones:<strong> Navidad:</strong> del 24 de diciembre de 2016 al 6 de enero de 2017. <strong>Semana Santa:</strong> del 10 al 17 de abril de 2017.</li>	<li>Los d&iacute;as festivos durante el curso no habr&aacute; clases. </li>	<li>Se podr&aacute;n anular los grupos en los que no se cubran el 50% de las plazas ofertadas (antes de inicio del curso y/o durante el transcurso del mismo).</li>	<li>El pago del precio p&uacute;blico da derecho a las clases o sesiones concertadas en el programa (uno, dos o tres d&iacute;as a la semana), siendo la participaci&oacute;n en competiciones y fines de semana un acuerdo entre el participante y la entidad o club correspondiente, as&iacute; como el pago de fichas federativas, pruebas de grado y/o vestuario deportivo del club.</li>	<li>Las clases que sean suspendidas por condiciones climatol&oacute;gicas adversas y/o por aver&iacute;a t&eacute;cnica (piscinas y gimnasios), y que no puedan ser impartidas en otro lugar alternativo, no tendr&aacute;n derecho a devoluci&oacute;n.</li>	<li>Por motivos de programaci&oacute;n, los espacios asignados a las actividades podr&aacute;n ser modificados por el Patronato Municipal de Deportes.</li>	<li>La inscripci&oacute;n en la actividad otorga al Ayuntamiento permiso para usar, publicar, exponer, producir, duplicar y distribuir reproducciones fotogr&aacute;ficas, grabaciones en audio/v&iacute;deo realizadas durante el evento en cualquier formato, para uso divulgativo y deportivo, respetando en todo momento el derecho al honor, a la intimidad personal y a la propia imagen de los usuarios.</li></ul><p><a href=""http://www.alcobendas.org/es/portal.do?TR=A&amp;IDR=1&amp;identificador=3919"" id=""Documento_3919_7812905170376"">Ver programaci&oacute;n completa de Actividades de las Escuelas Deportivas&nbsp;</a>&nbsp; </p></div></div><!--fin fichaterritoriales--></div>",01/06/2017,,27/05/2017,""
