"Pre-Deporte (4 a 6 años)","Escuelas deportivas","Deportes","Servicios Deportes","Deportes","Escuelas Deportivas","Otros","Infancia y Adolescencia", 25/09/2017, 30/06/2018,,,"Urbanizaciones","http://www.alcobendas.org/es/cargarFichaAgenda.do?identificador=1849","Polideportivo José Caballero","http://mapa.alcobendas.org/index.html?center=%2Ffeature%2Fpoi_deporte%5Bf_id%3D73%5D&amp;zoom=18","446527.0600000703","4488361.057","40.54427711895707","-3.6314827073471703","<table width=""40%"">	<tbody>	</tbody></table><div class=""modulo100""><div class=""datosinteres""><h4><img alt="""" class=""img_Sin"" id=""Imagen_10_6120663592094"" src=""http://www.alcobendas.org/recursos/img/Comunes/895869469_262010131247.gif"" /> Datos de inter&eacute;s</h4><div class=""separador""><h5>Descripci&oacute;n</h5><p>Actividad previa a la iniciaci&oacute;n deportiva, orientada al desarrollo de las&nbsp;habilidades motrices b&aacute;sicas (carrera, saltos, lanzamientos...) a trav&eacute;s de juegos, tareas individuales y de&nbsp;grupo. </p><p>La actividad corresponde a&nbsp;ni&ntilde;os que cumplen 4, 5 y 6 a&ntilde;os en 2017. Si la inscripci&oacute;n se realiza a partir del 1 de enero de 2018, el ni&ntilde;o tendr&aacute; que tener cumplidos 4, 5 o 6 a&ntilde;os antes de la fecha de inicio de la actividad.&nbsp; </p><h5>Horario</h5><p>Martes y jueves de 17:15 a 18:00 h. </p><h5>Precio</h5><p>Pago trimestral: </p><ul class=""tipo1"">	<li>Empadronados: 18 &euro;/mes </li>	<li>No empadronados&nbsp;&nbsp;27 &euro; /mes </li></ul><h5>Inscripci&oacute;n&nbsp;</h5><p><a href=""http://www.alcobendas.org/es/cargarFichaTramite.do?identificador=199"" id=""FichaTramite_199"">Toda la informaci&oacute;n para inscribirse</a> </p><h5>Bajas y devoluciones</h5><p>Consulta la informaci&oacute;n sobre <a href=""http://www.alcobendas.org/es/portal.do?TR=A&amp;IDR=1&amp;identificador=2976"" id=""Documento_2976_6916933198555"">Precios P&uacute;blicos del Patronato Municipal de Deportes&nbsp; </a></p><h5>Informaci&oacute;n de inter&eacute;s</h5><ul class=""tipo1"">	<li>Per&iacute;odos de vacaciones:<strong> Navidad:</strong> del 23 de diciembre de 2017 al&nbsp;7 de enero de 2018. <strong>Semana Santa:</strong> del 26 de marzo al 2 de abril de 2018.</li>	<li>Los d&iacute;as festivos durante el curso no habr&aacute; clases. </li>	<li>Se podr&aacute;n anular los grupos en los que no se cubran el 50% de las plazas ofertadas (antes de inicio del curso y/o durante el transcurso del mismo).</li>	<li>El pago del precio p&uacute;blico da derecho a las clases o sesiones concertadas en el programa (uno, dos o tres d&iacute;as a la semana), siendo la participaci&oacute;n en competiciones y fines de semana un acuerdo entre el participante y la entidad o club correspondiente, as&iacute; como el pago de fichas federativas, pruebas de grado y/o vestuario deportivo del club.</li>	<li>Las clases que sean suspendidas por condiciones climatol&oacute;gicas adversas y/o por aver&iacute;a t&eacute;cnica (piscinas y gimnasios), y que no puedan ser impartidas en otro lugar alternativo, no tendr&aacute;n derecho a devoluci&oacute;n.</li>	<li>Por motivos de programaci&oacute;n, los espacios asignados a las actividades podr&aacute;n ser modificados por el Patronato Municipal de Deportes.</li>	<li>La inscripci&oacute;n en la actividad otorga al Ayuntamiento permiso para usar, publicar, exponer, producir, duplicar y distribuir reproducciones fotogr&aacute;ficas, grabaciones en audio/v&iacute;deo realizadas durante el evento en cualquier formato, para uso divulgativo y deportivo, respetando en todo momento el derecho al honor, a la intimidad personal y a la propia imagen de los usuarios.</li></ul><a href=""http://www.alcobendas.org/es/portal.do?TR=A&amp;IDR=1&amp;identificador=3919"" id=""Documento_3919_130848270708"">Ver programaci&oacute;n completa de Actividades de las Escuelas Deportivas&nbsp;</a>&nbsp; </div></div><!--fin fichaterritoriales--></div>",01/06/2017,,27/06/2017,""
"Pre-Judo (4 a 6 años)","Escuelas deportivas","Deportes","Servicios Deportes","Deportes","Escuelas Deportivas","Otros","Infancia y Adolescencia", 25/09/2017, 30/06/2018,,,"","http://www.alcobendas.org/es/cargarFichaAgenda.do?identificador=1850","Polideportivo José Caballero","http://mapa.alcobendas.org/index.html?center=%2Ffeature%2Fpoi_deporte%5Bf_id%3D73%5D&amp;zoom=18","446527.0600000703","4488361.057","40.54427711895707","-3.6314827073471703","<table width=""40%"">	<tbody>	</tbody></table><div class=""modulo100""><div class=""datosinteres""><h4><img alt="""" class=""img_Sin"" id=""Imagen_10_1260395902672"" src=""http://www.alcobendas.org/recursos/img/Comunes/895869469_262010131247.gif"" /> Datos de inter&eacute;s</h4><div class=""separador""><h5>Descripci&oacute;n</h5><p>Actividad de iniciaci&oacute;n al deporte, orientada al desarrollo de las habiliddes psicootrices necesarias en estas edades. Iniciaci&ograve;n y aprendizaje de las t&eacute;cnicas b&aacute;sicas del yudo, utilizando los juegos como herramientas de trabajo. </p><p>La actividad corresponde a&nbsp;ni&ntilde;os que cumplen 4, 5 y 6 a&ntilde;os en 2016. Si la inscripci&oacute;n se realiza a partir del 1 de enero de 2018, en ni&ntilde;o tendr&aacute; que tener cumplidos 4, 5 o 6 a&ntilde;os antes de la fecha de inicio de la actividad.&nbsp; </p><h5>Horario</h5><ul class=""tipo1"">	<li>Viernes, de 17:00 a 18:00 h. Ciudad Deportiva Valdelasfuentes&nbsp;&nbsp;&nbsp; </li></ul><h5>Precio</h5><p>Pago trimestral: </p><ul class=""tipo1"">	<li>Empadronados: 13,30 &euro;/mes </li>	<li>No empadronados&nbsp;&nbsp;19,90 &euro; /mes </li></ul><h5>Inscripci&oacute;n&nbsp;</h5><p><a href=""http://www.alcobendas.org/es/cargarFichaTramite.do?identificador=199"" id=""FichaTramite_199"">Toda la informaci&oacute;n para inscribirse</a> </p><h5>Bajas y devoluciones</h5><p>Consulta la informaci&oacute;n sobre <a href=""http://www.alcobendas.org/es/portal.do?TR=A&amp;IDR=1&amp;identificador=2976"" id=""Documento_2976_3651413368753"">Precios P&uacute;blicos del Patronato Municipal de Deportes&nbsp; </a></p><h5>Informaci&oacute;n de inter&eacute;s</h5><ul class=""tipo1"">	<li>Per&iacute;odos de vacaciones:<strong> Navidad:</strong> del 23 de diciembre de 2017 al&nbsp;7 de enero de 2018. <strong>Semana Santa:</strong> del 26 de marzo al 2 de abril de 2018.</li>	<li>Los d&iacute;as festivos durante el curso no habr&aacute; clases. </li>	<li>Se podr&aacute;n anular los grupos en los que no se cubran el 50% de las plazas ofertadas (antes de inicio del curso y/o durante el transcurso del mismo).</li>	<li>El pago del precio p&uacute;blico da derecho a las clases o sesiones concertadas en el programa (uno, dos o tres d&iacute;as a la semana), siendo la participaci&oacute;n en competiciones y fines de semana un acuerdo entre el participante y la entidad o club correspondiente, as&iacute; como el pago de fichas federativas, pruebas de grado y/o vestuario deportivo del club.</li>	<li>Las clases que sean suspendidas por condiciones climatol&oacute;gicas adversas y/o por aver&iacute;a t&eacute;cnica (piscinas y gimnasios), y que no puedan ser impartidas en otro lugar alternativo, no tendr&aacute;n derecho a devoluci&oacute;n.</li>	<li>Por motivos de programaci&oacute;n, los espacios asignados a las actividades podr&aacute;n ser modificados por el Patronato Municipal de Deportes.</li>	<li>La inscripci&oacute;n en la actividad otorga al Ayuntamiento permiso para usar, publicar, exponer, producir, duplicar y distribuir reproducciones fotogr&aacute;ficas, grabaciones en audio/v&iacute;deo realizadas durante el evento en cualquier formato, para uso divulgativo y deportivo, respetando en todo momento el derecho al honor, a la intimidad personal y a la propia imagen de los usuarios.</li></ul><a href=""http://www.alcobendas.org/es/portal.do?TR=A&amp;IDR=1&amp;identificador=3919"" id=""Documento_3919_5115215592668"">Ver programaci&oacute;n completa de Actividades de las Escuelas Deportivas&nbsp;</a>&nbsp; </div></div><!--fin fichaterritoriales--></div>",01/06/2017,,27/06/2017,""
"Pre-Judo (4 a 6 años)","Escuelas deportivas","Deportes","Servicios Deportes","Deportes","Escuelas Deportivas","Otros","Infancia y Adolescencia", 25/09/2017, 30/06/2018,,,"","http://www.alcobendas.org/es/cargarFichaAgenda.do?identificador=1850","Ciudad Deportiva Valdelasfuentes","http://mapa.alcobendas.org/index.html?center=%2Ffeature%2Fpoi_deporte%5Bf_id%3D67%5D&amp;zoom=18","445113.15000008437","4489103.679999999","40.55087447901411","-3.6482436189666894","<table width=""40%"">	<tbody>	</tbody></table><div class=""modulo100""><div class=""datosinteres""><h4><img alt="""" class=""img_Sin"" id=""Imagen_10_1260395902672"" src=""http://www.alcobendas.org/recursos/img/Comunes/895869469_262010131247.gif"" /> Datos de inter&eacute;s</h4><div class=""separador""><h5>Descripci&oacute;n</h5><p>Actividad de iniciaci&oacute;n al deporte, orientada al desarrollo de las habiliddes psicootrices necesarias en estas edades. Iniciaci&ograve;n y aprendizaje de las t&eacute;cnicas b&aacute;sicas del yudo, utilizando los juegos como herramientas de trabajo. </p><p>La actividad corresponde a&nbsp;ni&ntilde;os que cumplen 4, 5 y 6 a&ntilde;os en 2016. Si la inscripci&oacute;n se realiza a partir del 1 de enero de 2018, en ni&ntilde;o tendr&aacute; que tener cumplidos 4, 5 o 6 a&ntilde;os antes de la fecha de inicio de la actividad.&nbsp; </p><h5>Horario</h5><ul class=""tipo1"">	<li>Viernes, de 17:00 a 18:00 h. Ciudad Deportiva Valdelasfuentes&nbsp;&nbsp;&nbsp; </li></ul><h5>Precio</h5><p>Pago trimestral: </p><ul class=""tipo1"">	<li>Empadronados: 13,30 &euro;/mes </li>	<li>No empadronados&nbsp;&nbsp;19,90 &euro; /mes </li></ul><h5>Inscripci&oacute;n&nbsp;</h5><p><a href=""http://www.alcobendas.org/es/cargarFichaTramite.do?identificador=199"" id=""FichaTramite_199"">Toda la informaci&oacute;n para inscribirse</a> </p><h5>Bajas y devoluciones</h5><p>Consulta la informaci&oacute;n sobre <a href=""http://www.alcobendas.org/es/portal.do?TR=A&amp;IDR=1&amp;identificador=2976"" id=""Documento_2976_3651413368753"">Precios P&uacute;blicos del Patronato Municipal de Deportes&nbsp; </a></p><h5>Informaci&oacute;n de inter&eacute;s</h5><ul class=""tipo1"">	<li>Per&iacute;odos de vacaciones:<strong> Navidad:</strong> del 23 de diciembre de 2017 al&nbsp;7 de enero de 2018. <strong>Semana Santa:</strong> del 26 de marzo al 2 de abril de 2018.</li>	<li>Los d&iacute;as festivos durante el curso no habr&aacute; clases. </li>	<li>Se podr&aacute;n anular los grupos en los que no se cubran el 50% de las plazas ofertadas (antes de inicio del curso y/o durante el transcurso del mismo).</li>	<li>El pago del precio p&uacute;blico da derecho a las clases o sesiones concertadas en el programa (uno, dos o tres d&iacute;as a la semana), siendo la participaci&oacute;n en competiciones y fines de semana un acuerdo entre el participante y la entidad o club correspondiente, as&iacute; como el pago de fichas federativas, pruebas de grado y/o vestuario deportivo del club.</li>	<li>Las clases que sean suspendidas por condiciones climatol&oacute;gicas adversas y/o por aver&iacute;a t&eacute;cnica (piscinas y gimnasios), y que no puedan ser impartidas en otro lugar alternativo, no tendr&aacute;n derecho a devoluci&oacute;n.</li>	<li>Por motivos de programaci&oacute;n, los espacios asignados a las actividades podr&aacute;n ser modificados por el Patronato Municipal de Deportes.</li>	<li>La inscripci&oacute;n en la actividad otorga al Ayuntamiento permiso para usar, publicar, exponer, producir, duplicar y distribuir reproducciones fotogr&aacute;ficas, grabaciones en audio/v&iacute;deo realizadas durante el evento en cualquier formato, para uso divulgativo y deportivo, respetando en todo momento el derecho al honor, a la intimidad personal y a la propia imagen de los usuarios.</li></ul><a href=""http://www.alcobendas.org/es/portal.do?TR=A&amp;IDR=1&amp;identificador=3919"" id=""Documento_3919_5115215592668"">Ver programaci&oacute;n completa de Actividades de las Escuelas Deportivas&nbsp;</a>&nbsp; </div></div><!--fin fichaterritoriales--></div>",01/06/2017,,27/06/2017,""
"Programa de Actividades Abono Deporte (2017-2018)","","Deportes","Servicios Deportes","Deportes","Abono Deporte","","Adultos|Discapacidad|Infancia y Adolescencia|Mayores", 01/10/2017, 30/06/2018,,,"","http://www.alcobendas.org/es/cargarFichaAgenda.do?identificador=509","Varios","","","","","","<div class=""datosinteres""><h4><img alt="""" class=""img_Sin"" id=""Imagen_10_8085257783916"" src=""http://www.alcobendas.org/recursos/img/Comunes/895869469_262010131247.gif"" /> Datos de inter&eacute;s</h4><div class=""separador""><h5>Descripci&oacute;n</h5><p>Puede consultar el folleto con todas las actividades deportivas programadas para los titulares de Abono Deporte. Informaci&oacute;n&nbsp;de horarios, precios, requisitos de inscripci&oacute;n, etc. </p><p><strong>Duraci&oacute;n de las actividades:</strong> Del 1 de octubre de 2017 al 30 de junio de 2018. Excepto en las que se especifique&nbsp;duraci&oacute;n de la actividad y los programas de ejercicio espec&iacute;fico del Servicio de Medicina Deportiva. </p><p><strong>Periodos de inscripci&oacute;n:</strong> </p><ul class=""tipo1"">	<li>Actividades no acu&aacute;ticas:&nbsp;A partir del&nbsp;7 de junio 2017 </li>	<li>Actividades acu&aacute;ticas: A partir del 14 de junio 2017</li>	<li>Actividades servicio m&eacute;dico: A partir del&nbsp;20 de julio 2017.</li></ul><h5></h5><div class=""teinteresa recursos""><h3>Documentos</h3><div class=""info""><ul>	<li><a href=""http://www.alcobendas.org/es/portal.do?TR=A&amp;IDR=1&amp;identificador=3040"" id=""Documento_3040_1815589689461"">Programa&nbsp;actividades&nbsp;Abono Deporte (2017-2018)</a></li></ul></div></div></div></div><!--fin fichaterritoriales--><div class=""modulo100""><!--fin fichaterritoriales--></div>",,,07/06/2017,""
"Psicomotricidad para titulares del Abono Deporte (4 y 5 años)","","Deportes","Servicios Deportes","Deportes|Infancia","Abono Deporte|Deportes","Otros|Otros","Infancia y Adolescencia", 01/10/2017, 30/06/2018, 17:15, 18:00,"Norte","http://www.alcobendas.org/es/cargarFichaAgenda.do?identificador=821","Ciudad Deportiva Valdelasfuentes","http://mapa.alcobendas.org/index.html?center=%2Ffeature%2Fpoi_deporte%5Bf_id%3D67%5D&amp;zoom=18","445113.15000008437","4489103.679999999","40.55087447901411","-3.6482436189666894","<div class=""modulo100""><div class=""datosinteres""><h4><img alt="""" class=""img_Sin"" id=""Imagen_10_1749403643545"" src=""http://www.alcobendas.org/recursos/img/Comunes/895869469_262010131247.gif"" /> Datos de inter&eacute;s</h4><div class=""separador""><h5>Descripci&oacute;n</h5><p>Desarrollo de&nbsp;las posibilidades motrices expresivas y creativas a partir del cuerpo. Importancia y beneficios de la actividad: a nivel motor, dominio del movimiento corporal.&nbsp;A nivel cognitivo, mejora de la atenci&oacute;n, concentraci&oacute;n, creatividad y memoria. A nivel social y afectivo, permitir&aacute; a los ni&ntilde;os conocer y afrontar sus miedos y relaciones con los dem&aacute;s. </p><p><strong>Edad:</strong> 4 y 5 a&ntilde;os. </p><h5>Requisitos</h5><ul class=""tipo1"">	<li>Estar dado de alta en el Abono Deporte. La entrada a la instalaci&oacute;n se realizar&aacute; acompa&ntilde;ado por un adulto abonado: cuando el adulto abonado no pueda acompa&ntilde;ar al ni&ntilde;o, se permitir&aacute; acceder a un tercero, que deber&aacute; sacar una tarjeta de acompa&ntilde;ante, de uso exclusivo para acompa&ntilde;arle al inicio y final de la clase, y cuyo coste es de 5,30 &euro;. La utilizaci&oacute;n indebida de la tarjeta ser&aacute; motivo de sanci&oacute;n.&nbsp;</li>	<li>Inscripci&oacute;n en la actividad </li></ul><h5>Horario </h5><p>Martes y jueves,&nbsp;de 17:15 a 18:00 horas. </p><h5>Precio</h5><p>Pago trimestral: </p><p><strong>15,50 &euro;/mes.&nbsp;2 d&iacute;as a la semana.&nbsp;&nbsp; </strong></p><h5>Inscripci&oacute;n&nbsp;&nbsp; </h5><p>Consulte&nbsp;la informaci&oacute;n necesaria&nbsp;para <a href=""http://www.alcobendas.org/es/cargarFichaTramite.do?identificador=226"" id=""FichaTramite_226"">inscribirse los titulares de&nbsp;abono deporte.</a> </p><h5>Bajas y devoluciones</h5><p>Consulte la informaci&oacute;n sobre <a href=""http://www.alcobendas.org/es/portal.do?TR=A&amp;IDR=1&amp;identificador=2976"" id=""Documento_2976_2804823072423"">administraci&oacute;n y cobranza precios p&uacute;blicos del PMD&nbsp;</a> </p><h5 class=""tipo1"">Informaci&oacute;n de inter&eacute;s:</h5><ul class=""tipo1"">	<li>Actividades de ni&ntilde;os - Vacaciones de Navidad: del 24/12/2017 al 07/01/2018, ambos incluidos; Vacaciones Semana Santa: del 26 de marzo al 2 de abril de 2018, ambos incluidos. Los d&iacute;as festivos durante el curso no habr&aacute; clases. </li>	<li>Se podr&aacute;n anular los grupos en los que no se cubran el 50% de las plazas ofertadas (antes de inicio del curso y/o durante el transcurso del mismo).</li>	<li>Las clases que sean suspendidas por condiciones climatol&oacute;gicas adversas y/o por aver&iacute;a t&eacute;cnica (piscinas y gimnasios), y que no puedan ser impartidas en otro lugar alternativo, no tendr&aacute;n derecho a devoluci&oacute;n.</li>	<li>Por motivos de programaci&oacute;n, los espacios asignados a las actividades podr&aacute;n ser modificados por el Patronato Municipal de Deportes.</li>	<li>La inscripci&oacute;n en la actividad otorga al Ayuntamiento permiso para usar, publicar, exponer, producir, duplicar y distribuir reproducciones fotogr&aacute;ficas, grabaciones en audio/v&iacute;deo realizadas durante el evento en cualquier formato, para uso divulgativo y deportivo, respetando en todo momento el derecho al honor, a la intimidad personal y a la propia imagen de los usuarios. </li></ul><p>Consulte el&nbsp; <a href=""http://www.alcobendas.org/es/portal.do?TR=A&amp;IDR=1&amp;identificador=3040"" id=""Documento_3040_3862682640344"">Programa de Actividades Abono Deporte&nbsp;</a>&nbsp;&nbsp; </p></div></div></div>",,,07/06/2016,""
"Relajación y Meditación (adultos)","Escuelas deportivas","Deportes","Servicios Deportes","Deportes","Escuelas Deportivas","Otros","Adultos", 25/09/2017, 30/06/2018,,,"Urbanizaciones","http://www.alcobendas.org/es/cargarFichaAgenda.do?identificador=1539","Polideportivo José Caballero","http://mapa.alcobendas.org/index.html?center=%2Ffeature%2Fpoi_deporte%5Bf_id%3D73%5D&amp;zoom=18","446527.0600000703","4488361.057","40.54427711895707","-3.6314827073471703","<div class=""modulo100""><div class=""datosinteres""><h4><img alt="""" class=""img_Sin"" id=""Imagen_10_3834126744417"" src=""http://www.alcobendas.org/recursos/img/Comunes/895869469_262010131247.gif"" /> Datos de inter&eacute;s</h4><div class=""separador""><h5>Descripci&oacute;n</h5><p>Las t&eacute;cnicas de relajaci&oacute;n y meditaci&oacute;n nos ayudan a recuperar el equilibrio y la calma tanto a nivel f&iacute;sico como mental. El descanso profundo y conseguir tranquilizar la mente es necesario para combatir los nocivos efectos del estr&eacute;s.&nbsp; </p><p><strong>Edad:</strong> a partir de&nbsp;18 a&ntilde;os. </p><h5>Horario</h5><p>Mi&eacute;rcoles, de 20:30 a 21:30 h </p><h5>Precio</h5><p>Pago trimestral: </p><ul class=""tipo1"">	<li>Empadronados:&nbsp;18,90 &euro;/mes</li>	<li>No empadronados:&nbsp;28,30 &euro;/mes&nbsp;&nbsp;&nbsp;&nbsp;&nbsp; </li></ul><h5>Inscripci&oacute;n&nbsp;</h5><p><a href=""http://www.alcobendas.org/es/cargarFichaTramite.do?identificador=199"" id=""FichaTramite_199"">Toda la informaci&oacute;n para inscribirse</a> </p><h5>Bajas y devoluciones</h5><p>Consulta la informaci&oacute;n sobre <a href=""http://www.alcobendas.org/es/portal.do?TR=A&amp;IDR=1&amp;identificador=2976"" id=""Documento_2976_262686781529"">Precios P&uacute;blicos del Patronato Municipal de Deportes&nbsp; </a></p><h5>Informaci&oacute;n de inter&eacute;s</h5><ul class=""tipo1"">	<li>Per&iacute;odos de vacaciones:<strong> Navidad:</strong> del 23 de diciembre de 2017 al 7 de enero de 2018. <strong>Semana Santa:</strong> del 26 de marzo al 2 de abril de 2018.</li>	<li>Los d&iacute;as festivos durante el curso no habr&aacute; clases. </li>	<li>Se podr&aacute;n anular los grupos en los que no se cubran el 50% de las plazas ofertadas (antes de inicio del curso y/o durante el transcurso del mismo).</li>	<li>El pago del precio p&uacute;blico da derecho a las clases o sesiones concertadas en el programa (uno, dos o tres d&iacute;as a la semana), siendo la participaci&oacute;n en competiciones y fines de semana un acuerdo entre el participante y la entidad o club correspondiente, as&iacute; como el pago de fichas federativas, pruebas de grado y/o vestuario deportivo del club.</li>	<li>Las clases que sean suspendidas por condiciones climatol&oacute;gicas adversas y/o por aver&iacute;a t&eacute;cnica (piscinas y gimnasios), y que no puedan ser impartidas en otro lugar alternativo, no tendr&aacute;n derecho a devoluci&oacute;n.</li>	<li>Por motivos de programaci&oacute;n, los espacios asignados a las actividades podr&aacute;n ser modificados por el Patronato Municipal de Deportes.</li>	<li>La inscripci&oacute;n en la actividad otorga al Ayuntamiento permiso para usar, publicar, exponer, producir, duplicar y distribuir reproducciones fotogr&aacute;ficas, grabaciones en audio/v&iacute;deo realizadas durante el evento en cualquier formato, para uso divulgativo y deportivo, respetando en todo momento el derecho al honor, a la intimidad personal y a la propia imagen de los usuarios.</li></ul><p><a href=""http://www.alcobendas.org/es/portal.do?TR=A&amp;IDR=1&amp;identificador=3919"" id=""Documento_3919_1419762365563"">Ver programaci&oacute;n completa de Actividades de las Escuelas Deportivas&nbsp;</a>&nbsp; </p></div></div><!--fin fichaterritoriales--></div>",01/06/2017,,27/06/2017,""
