"Gimnasia de mantenimiento","Escuelas deportivas","Deportes","Servicios Deportes","Deportes","Escuelas Deportivas","Gimnasia","Adultos", 25/09/2017, 30/06/2018,,,"","http://www.alcobendas.org/es/cargarFichaAgenda.do?identificador=1551","CEIP Federico García Lorca","http://mapa.alcobendas.org/index.html?center=%2Ffeature%2Fpoi_educacion%5Bf_id%3D90%5D&amp;zoom=18","445050.9300000851","4488572.264","40.546083163320375","-3.648932215076925","<div class=""modulo100""><div class=""datosinteres""><h4><img alt="""" class=""img_Sin"" id=""Imagen_10_2263514255231"" src=""http://www.alcobendas.org/recursos/img/Comunes/895869469_262010131247.gif"" /> Datos de inter&eacute;s</h4><div class=""separador""><h5>Descripci&oacute;n</h5><p>Actividad f&iacute;sica general de media intensidad, cuyo objetivo primordial es el mantenimiento y/o mejora de las cualidades f&iacute;sicas b&aacute;sicas (fuerza, resistencia, velocidad..). </p><h5 class=""tipo1"">Requisitos:</h5><p>Dirigido a mayores de 18 a&ntilde;os. </p><h5>Lugar&nbsp; y Horarios</h5><table width=""50%"">	<tbody>		<tr>			<td>&nbsp;Horario</td>			<td>&nbsp;D&iacute;as</td>			<td>&nbsp;Instalaci&oacute;n</td>		</tr>		<tr>			<td>&nbsp;09:30-10:20</td>			<td>&nbsp; M/J</td>			<td rowspan=""2"">&nbsp;C.D. Valdelasfuentes</td>		</tr>		<tr>			<td>&nbsp;10:30-11:20</td>			<td>&nbsp;&nbsp;M/J</td>		</tr>		<tr>			<td>&nbsp;10:15-11:05</td>			<td>&nbsp;&nbsp;M/J</td>			<td rowspan=""3"">&nbsp;P. M. Jos&eacute; Caballero</td>		</tr>		<tr>			<td>&nbsp;10:00-10:50</td>			<td>&nbsp; L/X</td>		</tr>		<tr>			<td>&nbsp;19:30-20:20</td>			<td>&nbsp; L/X</td>		</tr>		<tr>			<td>&nbsp;10:20-11:10</td>			<td>&nbsp; L/X</td>			<td>&nbsp;Pabell&oacute;n Centro</td>		</tr>		<tr>			<td>&nbsp;19:00-20:00</td>			<td>&nbsp;&nbsp;M/J</td>			<td>&nbsp;CEIP Garc&iacute;a Lorca</td>		</tr>		<tr>			<td>&nbsp;19:15-20:05</td>			<td>&nbsp;&nbsp;M/J</td>			<td>&nbsp;CEIP Emilio Casado</td>		</tr>	</tbody></table><h5>Precio</h5><p>Pago trimestral: </p><ul class=""tipo1"">	<li>Empadronados:&nbsp;22 &euro;/mes</li>	<li>No empadronados: 33 &euro;/mes&nbsp;&nbsp;&nbsp;&nbsp;&nbsp; </li></ul><h5>Inscripci&oacute;n&nbsp;</h5><p><a href=""http://www.alcobendas.org/es/cargarFichaTramite.do?identificador=199"" id=""FichaTramite_199"">Toda la informaci&oacute;n para inscribirse</a> </p><h5>Bajas y devoluciones</h5><p>Consulta la informaci&oacute;n sobre <a href=""http://www.alcobendas.org/es/portal.do?TR=A&amp;IDR=1&amp;identificador=2976"" id=""Documento_2976_5372545080435"">Precios P&uacute;blicos del Patronato Municipal de Deportes&nbsp; </a></p><h5>Informaci&oacute;n de inter&eacute;s</h5><ul class=""tipo1"">	<li>Per&iacute;odos de vacaciones:<strong> Navidad:</strong> del 23 de diciembre de 2017 al&nbsp;7 de enero de 2018. <strong>Semana Santa:</strong> 26 de marzo al 2 abril de 2018.</li>	<li>Los d&iacute;as festivos durante el curso no habr&aacute; clases. </li>	<li>Se podr&aacute;n anular los grupos en los que no se cubran el 50% de las plazas ofertadas (antes de inicio del curso y/o durante el transcurso del mismo).</li>	<li>El pago del precio p&uacute;blico da derecho a las clases o sesiones concertadas en el programa (uno, dos o tres d&iacute;as a la semana), siendo la participaci&oacute;n en competiciones y fines de semana un acuerdo entre el participante y la entidad o club correspondiente, as&iacute; como el pago de fichas federativas, pruebas de grado y/o vestuario deportivo del club.</li>	<li>Las clases que sean suspendidas por condiciones climatol&oacute;gicas adversas y/o por aver&iacute;a t&eacute;cnica (piscinas y gimnasios), y que no puedan ser impartidas en otro lugar alternativo, no tendr&aacute;n derecho a devoluci&oacute;n.</li>	<li>Por motivos de programaci&oacute;n, los espacios asignados a las actividades podr&aacute;n ser modificados por el Patronato Municipal de Deportes.</li>	<li>La inscripci&oacute;n en la actividad otorga al Ayuntamiento permiso para usar, publicar, exponer, producir, duplicar y distribuir reproducciones fotogr&aacute;ficas, grabaciones en audio/v&iacute;deo realizadas durante el evento en cualquier formato, para uso divulgativo y deportivo, respetando en todo momento el derecho al honor, a la intimidad personal y a la propia imagen de los usuarios.</li></ul><p><a href=""http://www.alcobendas.org/es/portal.do?TR=A&amp;IDR=1&amp;identificador=3919"" id=""Documento_3919_3542728240658"">Ver programaci&oacute;n completa de Actividades de las Escuelas Deportivas&nbsp;</a>&nbsp; </p></div></div><!--fin fichaterritoriales--></div>",01/06/2017,,27/06/2017,""
"Gimnasia de mantenimiento","Escuelas deportivas","Deportes","Servicios Deportes","Deportes","Escuelas Deportivas","Gimnasia","Adultos", 25/09/2017, 30/06/2018,,,"","http://www.alcobendas.org/es/cargarFichaAgenda.do?identificador=1551","CEIP Emilio Casado","http://mapa.alcobendas.org/index.html?center=%2Ffeature%2Fpoi_educacion%5Bf_id%3D88%5D&amp;zoom=18","445116.85600008443","4488356.558000001","40.54414437312843","-3.6481349640674017","<div class=""modulo100""><div class=""datosinteres""><h4><img alt="""" class=""img_Sin"" id=""Imagen_10_2263514255231"" src=""http://www.alcobendas.org/recursos/img/Comunes/895869469_262010131247.gif"" /> Datos de inter&eacute;s</h4><div class=""separador""><h5>Descripci&oacute;n</h5><p>Actividad f&iacute;sica general de media intensidad, cuyo objetivo primordial es el mantenimiento y/o mejora de las cualidades f&iacute;sicas b&aacute;sicas (fuerza, resistencia, velocidad..). </p><h5 class=""tipo1"">Requisitos:</h5><p>Dirigido a mayores de 18 a&ntilde;os. </p><h5>Lugar&nbsp; y Horarios</h5><table width=""50%"">	<tbody>		<tr>			<td>&nbsp;Horario</td>			<td>&nbsp;D&iacute;as</td>			<td>&nbsp;Instalaci&oacute;n</td>		</tr>		<tr>			<td>&nbsp;09:30-10:20</td>			<td>&nbsp; M/J</td>			<td rowspan=""2"">&nbsp;C.D. Valdelasfuentes</td>		</tr>		<tr>			<td>&nbsp;10:30-11:20</td>			<td>&nbsp;&nbsp;M/J</td>		</tr>		<tr>			<td>&nbsp;10:15-11:05</td>			<td>&nbsp;&nbsp;M/J</td>			<td rowspan=""3"">&nbsp;P. M. Jos&eacute; Caballero</td>		</tr>		<tr>			<td>&nbsp;10:00-10:50</td>			<td>&nbsp; L/X</td>		</tr>		<tr>			<td>&nbsp;19:30-20:20</td>			<td>&nbsp; L/X</td>		</tr>		<tr>			<td>&nbsp;10:20-11:10</td>			<td>&nbsp; L/X</td>			<td>&nbsp;Pabell&oacute;n Centro</td>		</tr>		<tr>			<td>&nbsp;19:00-20:00</td>			<td>&nbsp;&nbsp;M/J</td>			<td>&nbsp;CEIP Garc&iacute;a Lorca</td>		</tr>		<tr>			<td>&nbsp;19:15-20:05</td>			<td>&nbsp;&nbsp;M/J</td>			<td>&nbsp;CEIP Emilio Casado</td>		</tr>	</tbody></table><h5>Precio</h5><p>Pago trimestral: </p><ul class=""tipo1"">	<li>Empadronados:&nbsp;22 &euro;/mes</li>	<li>No empadronados: 33 &euro;/mes&nbsp;&nbsp;&nbsp;&nbsp;&nbsp; </li></ul><h5>Inscripci&oacute;n&nbsp;</h5><p><a href=""http://www.alcobendas.org/es/cargarFichaTramite.do?identificador=199"" id=""FichaTramite_199"">Toda la informaci&oacute;n para inscribirse</a> </p><h5>Bajas y devoluciones</h5><p>Consulta la informaci&oacute;n sobre <a href=""http://www.alcobendas.org/es/portal.do?TR=A&amp;IDR=1&amp;identificador=2976"" id=""Documento_2976_5372545080435"">Precios P&uacute;blicos del Patronato Municipal de Deportes&nbsp; </a></p><h5>Informaci&oacute;n de inter&eacute;s</h5><ul class=""tipo1"">	<li>Per&iacute;odos de vacaciones:<strong> Navidad:</strong> del 23 de diciembre de 2017 al&nbsp;7 de enero de 2018. <strong>Semana Santa:</strong> 26 de marzo al 2 abril de 2018.</li>	<li>Los d&iacute;as festivos durante el curso no habr&aacute; clases. </li>	<li>Se podr&aacute;n anular los grupos en los que no se cubran el 50% de las plazas ofertadas (antes de inicio del curso y/o durante el transcurso del mismo).</li>	<li>El pago del precio p&uacute;blico da derecho a las clases o sesiones concertadas en el programa (uno, dos o tres d&iacute;as a la semana), siendo la participaci&oacute;n en competiciones y fines de semana un acuerdo entre el participante y la entidad o club correspondiente, as&iacute; como el pago de fichas federativas, pruebas de grado y/o vestuario deportivo del club.</li>	<li>Las clases que sean suspendidas por condiciones climatol&oacute;gicas adversas y/o por aver&iacute;a t&eacute;cnica (piscinas y gimnasios), y que no puedan ser impartidas en otro lugar alternativo, no tendr&aacute;n derecho a devoluci&oacute;n.</li>	<li>Por motivos de programaci&oacute;n, los espacios asignados a las actividades podr&aacute;n ser modificados por el Patronato Municipal de Deportes.</li>	<li>La inscripci&oacute;n en la actividad otorga al Ayuntamiento permiso para usar, publicar, exponer, producir, duplicar y distribuir reproducciones fotogr&aacute;ficas, grabaciones en audio/v&iacute;deo realizadas durante el evento en cualquier formato, para uso divulgativo y deportivo, respetando en todo momento el derecho al honor, a la intimidad personal y a la propia imagen de los usuarios.</li></ul><p><a href=""http://www.alcobendas.org/es/portal.do?TR=A&amp;IDR=1&amp;identificador=3919"" id=""Documento_3919_3542728240658"">Ver programaci&oacute;n completa de Actividades de las Escuelas Deportivas&nbsp;</a>&nbsp; </p></div></div><!--fin fichaterritoriales--></div>",01/06/2017,,27/06/2017,""
"Gimnasia de mantenimiento","Escuelas deportivas","Deportes","Servicios Deportes","Deportes","Escuelas Deportivas","Gimnasia","Adultos", 25/09/2017, 30/06/2018,,,"","http://www.alcobendas.org/es/cargarFichaAgenda.do?identificador=1551","Pabellón Distrito Centro","http://mapa.alcobendas.org/index.html?center=%2Ffeature%2Fpoi_deporte%5Bf_id%3D501%5D&amp;zoom=18","446229.7560000731","4487451.292","40.53606234562023","-3.6349160988526634","<div class=""modulo100""><div class=""datosinteres""><h4><img alt="""" class=""img_Sin"" id=""Imagen_10_2263514255231"" src=""http://www.alcobendas.org/recursos/img/Comunes/895869469_262010131247.gif"" /> Datos de inter&eacute;s</h4><div class=""separador""><h5>Descripci&oacute;n</h5><p>Actividad f&iacute;sica general de media intensidad, cuyo objetivo primordial es el mantenimiento y/o mejora de las cualidades f&iacute;sicas b&aacute;sicas (fuerza, resistencia, velocidad..). </p><h5 class=""tipo1"">Requisitos:</h5><p>Dirigido a mayores de 18 a&ntilde;os. </p><h5>Lugar&nbsp; y Horarios</h5><table width=""50%"">	<tbody>		<tr>			<td>&nbsp;Horario</td>			<td>&nbsp;D&iacute;as</td>			<td>&nbsp;Instalaci&oacute;n</td>		</tr>		<tr>			<td>&nbsp;09:30-10:20</td>			<td>&nbsp; M/J</td>			<td rowspan=""2"">&nbsp;C.D. Valdelasfuentes</td>		</tr>		<tr>			<td>&nbsp;10:30-11:20</td>			<td>&nbsp;&nbsp;M/J</td>		</tr>		<tr>			<td>&nbsp;10:15-11:05</td>			<td>&nbsp;&nbsp;M/J</td>			<td rowspan=""3"">&nbsp;P. M. Jos&eacute; Caballero</td>		</tr>		<tr>			<td>&nbsp;10:00-10:50</td>			<td>&nbsp; L/X</td>		</tr>		<tr>			<td>&nbsp;19:30-20:20</td>			<td>&nbsp; L/X</td>		</tr>		<tr>			<td>&nbsp;10:20-11:10</td>			<td>&nbsp; L/X</td>			<td>&nbsp;Pabell&oacute;n Centro</td>		</tr>		<tr>			<td>&nbsp;19:00-20:00</td>			<td>&nbsp;&nbsp;M/J</td>			<td>&nbsp;CEIP Garc&iacute;a Lorca</td>		</tr>		<tr>			<td>&nbsp;19:15-20:05</td>			<td>&nbsp;&nbsp;M/J</td>			<td>&nbsp;CEIP Emilio Casado</td>		</tr>	</tbody></table><h5>Precio</h5><p>Pago trimestral: </p><ul class=""tipo1"">	<li>Empadronados:&nbsp;22 &euro;/mes</li>	<li>No empadronados: 33 &euro;/mes&nbsp;&nbsp;&nbsp;&nbsp;&nbsp; </li></ul><h5>Inscripci&oacute;n&nbsp;</h5><p><a href=""http://www.alcobendas.org/es/cargarFichaTramite.do?identificador=199"" id=""FichaTramite_199"">Toda la informaci&oacute;n para inscribirse</a> </p><h5>Bajas y devoluciones</h5><p>Consulta la informaci&oacute;n sobre <a href=""http://www.alcobendas.org/es/portal.do?TR=A&amp;IDR=1&amp;identificador=2976"" id=""Documento_2976_5372545080435"">Precios P&uacute;blicos del Patronato Municipal de Deportes&nbsp; </a></p><h5>Informaci&oacute;n de inter&eacute;s</h5><ul class=""tipo1"">	<li>Per&iacute;odos de vacaciones:<strong> Navidad:</strong> del 23 de diciembre de 2017 al&nbsp;7 de enero de 2018. <strong>Semana Santa:</strong> 26 de marzo al 2 abril de 2018.</li>	<li>Los d&iacute;as festivos durante el curso no habr&aacute; clases. </li>	<li>Se podr&aacute;n anular los grupos en los que no se cubran el 50% de las plazas ofertadas (antes de inicio del curso y/o durante el transcurso del mismo).</li>	<li>El pago del precio p&uacute;blico da derecho a las clases o sesiones concertadas en el programa (uno, dos o tres d&iacute;as a la semana), siendo la participaci&oacute;n en competiciones y fines de semana un acuerdo entre el participante y la entidad o club correspondiente, as&iacute; como el pago de fichas federativas, pruebas de grado y/o vestuario deportivo del club.</li>	<li>Las clases que sean suspendidas por condiciones climatol&oacute;gicas adversas y/o por aver&iacute;a t&eacute;cnica (piscinas y gimnasios), y que no puedan ser impartidas en otro lugar alternativo, no tendr&aacute;n derecho a devoluci&oacute;n.</li>	<li>Por motivos de programaci&oacute;n, los espacios asignados a las actividades podr&aacute;n ser modificados por el Patronato Municipal de Deportes.</li>	<li>La inscripci&oacute;n en la actividad otorga al Ayuntamiento permiso para usar, publicar, exponer, producir, duplicar y distribuir reproducciones fotogr&aacute;ficas, grabaciones en audio/v&iacute;deo realizadas durante el evento en cualquier formato, para uso divulgativo y deportivo, respetando en todo momento el derecho al honor, a la intimidad personal y a la propia imagen de los usuarios.</li></ul><p><a href=""http://www.alcobendas.org/es/portal.do?TR=A&amp;IDR=1&amp;identificador=3919"" id=""Documento_3919_3542728240658"">Ver programaci&oacute;n completa de Actividades de las Escuelas Deportivas&nbsp;</a>&nbsp; </p></div></div><!--fin fichaterritoriales--></div>",01/06/2017,,27/06/2017,""
"Gimnasia familiar (24 a 47 meses)","Escuelas deportivas","Deportes","Servicios Deportes","Deportes|Infancia","Escuelas Deportivas|Deportes","Gimnasia|Gimnasia","Infancia y Adolescencia", 25/09/2017, 30/06/2018,,,"Urbanizaciones","http://www.alcobendas.org/es/cargarFichaAgenda.do?identificador=1844","Polideportivo José Caballero","http://mapa.alcobendas.org/index.html?center=%2Ffeature%2Fpoi_deporte%5Bf_id%3D73%5D&amp;zoom=18","446527.0600000703","4488361.057","40.54427711895707","-3.6314827073471703","<div class=""modulo100""><div class=""datosinteres""><h4><img alt="""" class=""img_Sin"" id=""Imagen_10_1552165485157"" src=""http://www.alcobendas.org/recursos/img/Comunes/895869469_262010131247.gif"" /> Datos de inter&eacute;s</h4><div class=""separador""><h5>Descripci&oacute;n</h5><p>Actividad que plantea propuestas divertidas y conjuntas a ni&ntilde;os y padres. Juegos psicomotores, de cooperaci&oacute;n y socializaci&oacute;n. </p><p>Uno de los d&iacute;as, la actividad se realiza en gimnasio y el otro, en piscina (viernes). Un acompa&ntilde;ante adulto por ni&ntilde;o inscrito..&nbsp; </p><p>Dirigido a ni&ntilde;os de 24 a 47 meses. </p><p>La actividad corresponde a ni&ntilde;os que cumplen 2 y 3 a&ntilde;os en el 2017. </p><p>Si la inscripci&oacute;n se realiza a partir del 1 de enero de 2018, el ni&ntilde;o tendr&aacute; que tener cumplidos 2 o 3 a&ntilde;os en el momento de la inscripci&oacute;n.&nbsp; </p><h5>Horario</h5><ul class=""tipo1"">	<li>Mi&eacute;rcoles y Viernes: 18:30 - 19:15 h. </li></ul><h5>Precio</h5><p>Pago trimestral. </p><ul class=""tipo1"">	<li>Empadronados: 18 &euro;/mes</li>	<li>No empadronados:&nbsp;27 &euro;/mes</li></ul><h5>Inscripci&oacute;n&nbsp;</h5><p><a href=""http://www.alcobendas.org/es/cargarFichaTramite.do?identificador=199"" id=""FichaTramite_199"">Toda la informaci&oacute;n para inscribirse</a> </p><h5>Bajas y devoluciones</h5><p>Consulta la informaci&oacute;n sobre <a href=""http://www.alcobendas.org/es/portal.do?TR=A&amp;IDR=1&amp;identificador=2976"" id=""Documento_2976_3775097099076"">Precios P&uacute;blicos del Patronato Municipal de Deportes </a></p><h5>Informaci&oacute;n de inter&eacute;s</h5><ul class=""tipo1"">	<li>Per&iacute;odos de vacaciones:<strong> Navidad:</strong> del 23 de diciembre de 2017 al&nbsp;7 de enero de 2018. <strong>Semana Santa:</strong> del 26 de marzo al 2 de abril de 2018.</li>	<li>Los d&iacute;as festivos durante el curso no habr&aacute; clases. </li>	<li>Se podr&aacute;n anular los grupos en los que no se cubran el 50% de las plazas ofertadas (antes de inicio del curso y/o durante el transcurso del mismo).</li>	<li>El pago del precio p&uacute;blico da derecho a las clases o sesiones concertadas en el programa (uno, dos o tres d&iacute;as a la semana), siendo la participaci&oacute;n en competiciones y fines de semana un acuerdo entre el participante y la entidad o club correspondiente, as&iacute; como el pago de fichas federativas, pruebas de grado y/o vestuario deportivo del club.</li>	<li>Las clases que sean suspendidas por condiciones climatol&oacute;gicas adversas y/o por aver&iacute;a t&eacute;cnica (piscinas y gimnasios), y que no puedan ser impartidas en otro lugar alternativo, no tendr&aacute;n derecho a devoluci&oacute;n.</li>	<li>Por motivos de programaci&oacute;n, los espacios asignados a las actividades podr&aacute;n ser modificados por el Patronato Municipal de Deportes.</li>	<li>La inscripci&oacute;n en la actividad otorga al Ayuntamiento permiso para usar, publicar, exponer, producir, duplicar y distribuir reproducciones fotogr&aacute;ficas, grabaciones en audio/v&iacute;deo realizadas durante el evento en cualquier formato, para uso divulgativo y deportivo, respetando en todo momento el derecho al honor, a la intimidad personal y a la propia imagen de los usuarios.</li></ul><p><a href=""http://www.alcobendas.org/es/portal.do?TR=A&amp;IDR=1&amp;identificador=3919"" id=""Documento_3919_6801766533040"">Ver programaci&oacute;n completa de Actividades de las Escuelas Deportivas&nbsp;</a>&nbsp; </p></div></div><!--fin fichaterritoriales--></div>",01/06/2017,,27/06/2017,""
"Gimnasia familiar para titulares del Abono Deporte  (2 y 3 años)","","Deportes","Servicios Deportes","Deportes|Infancia","Abono Deporte|Deportes","Otros|Otros","Infancia y Adolescencia", 01/10/2017, 30/06/2018, 17:15, 18:00,"Norte","http://www.alcobendas.org/es/cargarFichaAgenda.do?identificador=431","Ciudad Deportiva Valdelasfuentes","http://mapa.alcobendas.org/index.html?center=%2Ffeature%2Fpoi_deporte%5Bf_id%3D67%5D&amp;zoom=18","445113.15000008437","4489103.679999999","40.55087447901411","-3.6482436189666894","<div class=""modulo100""><div class=""datosinteres""><h4><img alt="""" class=""img_Sin"" id=""Imagen_10_9014998742862"" src=""http://www.alcobendas.org/recursos/img/Comunes/895869469_262010131247.gif"" /> Datos de inter&eacute;s</h4><div class=""separador""><h5>Descripci&oacute;n</h5><p>Actividad dirigida a ni&ntilde;os de 2 y 3 a&ntilde;os que se realiza en compa&ntilde;&iacute;a&nbsp;del padre o&nbsp; la madre, que participa de forma activa en la clase, cuyo objetivo principal es el desarrollo de las habilidades motrices y propiciar la relaci&oacute;n afectiva con los padres a trav&eacute;s del juego. El viernes, la actividad se realizar&aacute; en la piscina. </p><h5>Requisitos</h5><ul class=""tipo1"">	<li>Estar dado de alta en el Abono Deporte, tanto el ni&ntilde;o como el adulto acompa&ntilde;ante. La entrada a la instalaci&oacute;n se realizar&aacute; acompa&ntilde;ado por un adulto abonado: cuando el adulto no pueda acompa&ntilde;ar al ni&ntilde;o, se permitir&aacute; acceder a un tercero,&nbsp;que deber&aacute; sacar una tarjeta de acompa&ntilde;ante, de uso exclusivo para acompa&ntilde;ante al inicio y final de la clase, y cuyo coste es de&nbsp;5,30 &euro;. La utilizaci&oacute;n indebida de la tarjeta ser&aacute; motivo de sanci&oacute;n. </li>	<li>Inscripci&oacute;n en la actividad. </li></ul><h5>Horario </h5><p>Martes&nbsp;y&nbsp;viernes de 17:15 a 18:00 horas.&nbsp; </p><h5>Precio</h5><p>Pago trimestral: </p><p>15,50 &euro;/mes. 2 d&iacute;as a la semana. </p><h5>Inscripci&oacute;n&nbsp;&nbsp; </h5><p>Consulte&nbsp;la informaci&oacute;n necesaria&nbsp;para <a href=""http://www.alcobendas.org/es/cargarFichaTramite.do?identificador=226"" id=""FichaTramite_226"">inscribirse los titulares de&nbsp;abono deporte.</a> </p><h5>Bajas y devoluciones</h5><p>Consulte la informaci&oacute;n sobre <a href=""http://www.alcobendas.org/es/portal.do?TR=A&amp;IDR=1&amp;identificador=2976"" id=""Documento_2976_8427164802870"">Administraci&oacute;n y cobranza precios p&uacute;blicos del PMD&nbsp;</a> </p><h5 class=""tipo1"">Informaci&oacute;n de inter&eacute;s:</h5><ul class=""tipo1"">	<li>Actividades de ni&ntilde;os - Vacaciones de Navidad: del 24/12/2017 al 07/01/2018, ambos incluidos; Vacaciones Semana Santa: del&nbsp;26 de marzo al 2 de abril de 2018, ambos incluidos. Los d&iacute;as festivos durante el curso no habr&aacute; clases. </li>	<li>Se podr&aacute;n anular los grupos en los que no se cubran el 50% de las plazas ofertadas (antes de inicio del curso y/o durante el transcurso del mismo).</li>	<li>Las clases que sean suspendidas por condiciones climatol&oacute;gicas adversas y/o por aver&iacute;a t&eacute;cnica (piscinas y gimnasios), y que no puedan ser impartidas en otro lugar alternativo, no tendr&aacute;n derecho a devoluci&oacute;n.</li>	<li>Por motivos de programaci&oacute;n, los espacios asignados a las actividades podr&aacute;n ser modificados por el Patronato Municipal de Deportes.</li>	<li>La inscripci&oacute;n en la actividad otorga al Ayuntamiento permiso para usar, publicar, exponer, producir, duplicar y distribuir reproducciones fotogr&aacute;ficas, grabaciones en audio/v&iacute;deo realizadas durante el evento en cualquier formato, para uso divulgativo y deportivo, respetando en todo momento el derecho al honor, a la intimidad personal y a la propia imagen de los usuarios. </li></ul><p>Consulte el&nbsp; <a href=""http://www.alcobendas.org/es/portal.do?TR=A&amp;IDR=1&amp;identificador=3040"" id=""Documento_3040_1201196031851"">Programa de Actividades Abono Deporte&nbsp;</a>&nbsp;&nbsp; </p></div></div></div>",,,07/06/2017,""
